{
  "id": "01J8ZB0000000000000000R1",
  "targetId": "01J8ZA0000000000000000T1",
  "operation": {
    "operationClass": "BUILD",
    "command": "./gradlew",
    "args": ["--no-daemon", ":core-engine:testFullDebugUnitTest", ":core-engine:testPlayDebugUnitTest", ":core-engine:checkLicense"],
    "workingDirectory": "/data/user/0/dev.aarso.full/workspace/android-ide-core"
  },
  "workingRevision": "ab3567ecf1a2b3c4d5e6f7089a1b2c3d4e5f6071",
  "environment": {
    "envVars": { "GRADLE_OPTS": "-Xmx2g", "CI": "false" }
  },
  "secretHandles": [],
  "budget": {
    "wallClockSeconds": 1800,
    "maxOutputBytes": 10485760,
    "sessionReauthorization": { "maxSessionSeconds": 3600, "requiresUserReauth": true },
    "thermalStateObservabilityRequired": true,
    "thermalPausePolicyRef": null
  },
  "authorityGrant": {
    "grantId": "01J8ZG0000000000000000A1",
    "scopes": ["execution.build.gradle"]
  },
  "expectedOutputs": [
    { "role": "test-report", "mediaType": "application/xml" }
  ],
  "idempotencyKey": null,
  "sideEffectExternal": false,
  "externalDuplicateBehavior": null,
  "fgsType": "NONE",
  "openEnded": false,
  "specialUseJustification": null,
  "unknownFields": {}
}
