{
  "id": "01J8ZB0000000000000000R3",
  "targetId": "01J8ZA0000000000000000T3",
  "operation": {
    "operationClass": "CI_DISPATCH",
    "command": ".github/workflows/ci.yml",
    "args": ["--ref", "main"],
    "workingDirectory": null
  },
  "workingRevision": "ab3567ecf1a2b3c4d5e6f7089a1b2c3d4e5f6071",
  "environment": { "envVars": {} },
  "secretHandles": [
    { "handleId": "01J8ZH0000000000000000S2", "purpose": "github.actions_dispatch_pat" }
  ],
  "budget": {
    "wallClockSeconds": 600,
    "maxOutputBytes": null,
    "sessionReauthorization": { "maxSessionSeconds": 600, "requiresUserReauth": false },
    "thermalStateObservabilityRequired": false,
    "thermalPausePolicyRef": null
  },
  "authorityGrant": {
    "grantId": "01J8ZG0000000000000000A3",
    "scopes": ["execution.ci.dispatch"]
  },
  "expectedOutputs": [
    { "role": "ci-run-ref", "mediaType": "application/json" }
  ],
  "idempotencyKey": "ci-dispatch-01J8ZB0000000000000000R3-attempt-1",
  "sideEffectExternal": true,
  "externalDuplicateBehavior": "RETURN_PRIOR_RESULT",
  "fgsType": "NONE",
  "openEnded": false,
  "specialUseJustification": null,
  "unknownFields": {}
}
