{
  "id": "01J8ZB0000000000000000RA",
  "targetId": "01J8ZA0000000000000000T1",
  "operation": {
    "operationClass": "ONE_SHOT_COMMAND",
    "command": "curl",
    "args": ["-H", "Authorization: Bearer $ANTHROPIC_API_KEY", "https://api.anthropic.com/v1/messages"],
    "workingDirectory": null
  },
  "workingRevision": null,
  "environment": {
    "envVars": {
      "ANTHROPIC_API_KEY": "sk-ant-api03-FAKE1234567890abcdEFGHijklMNOPqrstUVWXyz0000000000AA"
    }
  },
  "secretHandles": [],
  "budget": {
    "wallClockSeconds": 30,
    "maxOutputBytes": 1048576,
    "sessionReauthorization": { "maxSessionSeconds": 30, "requiresUserReauth": false },
    "thermalStateObservabilityRequired": false,
    "thermalPausePolicyRef": null
  },
  "authorityGrant": { "grantId": "01J8ZG0000000000000000AA", "scopes": ["execution.oneShotCommand"] },
  "expectedOutputs": [],
  "idempotencyKey": null,
  "sideEffectExternal": false,
  "externalDuplicateBehavior": null,
  "fgsType": "NONE",
  "openEnded": false,
  "specialUseJustification": null,
  "unknownFields": {}
}
